{
  "proposal_id":"usability-20",
  "revision":1,
  "source_digest":"sha256:d3b71ac4ee17b13ca45329a282d6864bc55d3d4ddf5de4c9ec42833d16d137d7",
  "created_at":"2026-09-20T00:00:00Z",
  "producer":"fixture",
  "items":[
    {"change_id":"c01","path":"/setting01","operation":"replace","expected_old":1,"proposed_value":101,"explanation":"表示間隔を調整"},
    {"change_id":"c02","path":"/setting02","operation":"replace","expected_old":2,"proposed_value":102,"explanation":"表示間隔を調整"},
    {"change_id":"c03","path":"/setting03","operation":"replace","expected_old":3,"proposed_value":103,"explanation":"コメント対象"},
    {"change_id":"c04","path":"/setting04","operation":"replace","expected_old":4,"proposed_value":104,"explanation":"表示間隔を調整"},
    {"change_id":"c05","path":"/setting05","operation":"replace","expected_old":5,"proposed_value":105,"explanation":"表示間隔を調整"},
    {"change_id":"c06","path":"/setting06","operation":"replace","expected_old":6,"proposed_value":106,"explanation":"表示間隔を調整"},
    {"change_id":"c07","path":"/setting07","operation":"replace","expected_old":7,"proposed_value":107,"explanation":"コメント対象"},
    {"change_id":"c08","path":"/setting08","operation":"replace","expected_old":8,"proposed_value":108,"explanation":"表示間隔を調整"},
    {"change_id":"c09","path":"/setting09","operation":"replace","expected_old":9,"proposed_value":109,"explanation":"却下対象"},
    {"change_id":"c10","path":"/setting10","operation":"replace","expected_old":10,"proposed_value":110,"explanation":"却下対象"},
    {"change_id":"c11","path":"/setting11","operation":"replace","expected_old":11,"proposed_value":111,"explanation":"却下対象"},
    {"change_id":"c12","path":"/setting12","operation":"replace","expected_old":12,"proposed_value":112,"explanation":"却下対象"},
    {"change_id":"c13","path":"/setting13","operation":"replace","expected_old":13,"proposed_value":113,"explanation":"個別承認"},
    {"change_id":"c14","path":"/setting14","operation":"replace","expected_old":14,"proposed_value":114,"explanation":"個別承認"},
    {"change_id":"c15","path":"/setting15","operation":"replace","expected_old":15,"proposed_value":115,"explanation":"個別承認"},
    {"change_id":"c16","path":"/setting16","operation":"replace","expected_old":16,"proposed_value":116,"explanation":"個別承認"},
    {"change_id":"c17","path":"/setting17","operation":"replace","expected_old":17,"proposed_value":117,"explanation":"未解決コメントを残す"},
    {"change_id":"c18","path":"/setting18","operation":"replace","expected_old":18,"proposed_value":118,"explanation":"却下対象"},
    {"change_id":"c19","path":"/password","operation":"replace","expected_old":"fixture-password","proposed_value":"fixture-password-next","explanation":"機密値の操作を確認"},
    {"change_id":"c20","path":"/items/-","operation":"add","proposed_value":"c","explanation":"配列末尾へ追加"}
  ]
}
