{
  "proposal_id": "proposal-json-values",
  "revision": 7,
  "source_digest": "sha256:bbbbbbbbbbbbbbbbbbbbbbbbbbbbbbbbbbbbbbbbbbbbbbbbbbbbbbbbbbbbbbbb",
  "created_at": "2026-09-11T09:00:00+09:00",
  "items": [
    {
      "change_id": "replace-object",
      "path": "/layout",
      "operation": "replace",
      "expected_old": {"columns": 2},
      "proposed_value": {"columns": 3, "gaps": [8, 16], "fluid": true, "note": null},
      "explanation": "Exercise all JSON value types."
    }
  ]
}
